{
  "$schema": "https://json-schema.org/draft/2020-12/schema",
  "$defs": {
    "id": {
      "type": "string",
      "pattern": "^[a-z0-9][a-z0-9-]*$",
      "minLength": 3
    },
    "sourceIds": {
      "type": "array",
      "items": {
        "type": "string",
        "minLength": 3
      },
      "minItems": 1,
      "uniqueItems": true
    },
    "contentStatus": {
      "enum": [
        "planned",
        "draft",
        "machine-assisted",
        "human-reviewed",
        "production-ready",
        "fixture"
      ]
    },
    "translationReviewStatus": {
      "enum": [
        "draft",
        "machine-assisted",
        "human-reviewed"
      ]
    },
    "ref": {
      "type": "object",
      "required": [
        "id",
        "path"
      ],
      "properties": {
        "id": {
          "$ref": "#/$defs/id"
        },
        "path": {
          "type": "string",
          "minLength": 3
        }
      },
      "additionalProperties": false
    },
    "reviewMetadata": {
      "type": "object",
      "required": [
        "reviewStage",
        "reviewReason"
      ],
      "properties": {
        "firstIntroducedIn": {
          "type": [
            "string",
            "null"
          ]
        },
        "reviewStage": {
          "type": "integer",
          "minimum": 1
        },
        "reviewReason": {
          "type": "string",
          "minLength": 3
        },
        "previousExerciseId": {
          "type": [
            "string",
            "null"
          ]
        }
      },
      "additionalProperties": false
    }
  },
  "title": "HSK lesson",
  "type": "object",
  "required": [
    "recordType",
    "id",
    "syllabusVersion",
    "level",
    "unitId",
    "order",
    "topic",
    "titleZh",
    "titleVi",
    "objectives",
    "prerequisiteIds",
    "vocabularyRefs",
    "grammarRefs",
    "characterRefs",
    "sections",
    "practiceRefs",
    "reviewRefs",
    "estimatedMinutes",
    "difficulty",
    "sourceIds",
    "contentStatus",
    "translationReviewStatus",
    "contentVersion",
    "reviewMetadata"
  ],
  "properties": {
    "recordType": {
      "const": "lesson"
    },
    "id": {
      "$ref": "#/$defs/id"
    },
    "syllabusVersion": {
      "type": "string",
      "minLength": 3
    },
    "level": {
      "type": "integer",
      "minimum": 1,
      "maximum": 9
    },
    "unitId": {
      "$ref": "#/$defs/id"
    },
    "order": {
      "type": "integer",
      "minimum": 1
    },
    "topic": {
      "type": "string",
      "minLength": 1
    },
    "titleZh": {
      "type": "string",
      "minLength": 1
    },
    "titleVi": {
      "type": "string",
      "minLength": 1
    },
    "objectives": {
      "type": "array",
      "items": {
        "type": "string",
        "minLength": 1
      },
      "minItems": 1
    },
    "prerequisiteIds": {
      "type": "array",
      "items": {
        "$ref": "#/$defs/id"
      },
      "uniqueItems": true
    },
    "vocabularyRefs": {
      "type": "array",
      "items": {
        "$ref": "#/$defs/id"
      },
      "uniqueItems": true
    },
    "grammarRefs": {
      "type": "array",
      "items": {
        "$ref": "#/$defs/id"
      },
      "uniqueItems": true
    },
    "characterRefs": {
      "type": "array",
      "items": {
        "$ref": "#/$defs/id"
      },
      "uniqueItems": true
    },
    "prerequisiteMasteryId": {
      "type": [
        "string",
        "null"
      ]
    },
    "knowledgeMap": {
      "type": "object",
      "required": [
        "new",
        "review",
        "reinforcement",
        "extension"
      ],
      "additionalProperties": true
    },
    "sections": {
      "type": "array",
      "items": {
        "type": "object",
        "required": [
          "id",
          "type",
          "titleVi"
        ],
        "properties": {
          "id": {
            "$ref": "#/$defs/id"
          },
          "type": {
            "enum": [
              "situation",
              "vocabulary",
              "character",
              "grammar",
              "dialogue",
              "reading",
              "listening",
              "pronunciation",
              "guided-practice",
              "independent-practice",
              "summary",
              "review"
            ]
          },
          "titleVi": {
            "type": "string",
            "minLength": 1
          },
          "content": {
            "type": [
              "string",
              "array",
              "object",
              "null"
            ]
          }
        },
        "additionalProperties": true
      },
      "minItems": 1
    },
    "practiceRefs": {
      "type": "array",
      "items": {
        "$ref": "#/$defs/id"
      },
      "uniqueItems": true
    },
    "reviewRefs": {
      "type": "array",
      "items": {
        "$ref": "#/$defs/id"
      },
      "uniqueItems": true
    },
    "estimatedMinutes": {
      "type": "integer",
      "minimum": 5,
      "maximum": 180
    },
    "difficulty": {
      "type": "integer",
      "minimum": 1,
      "maximum": 9
    },
    "sourceIds": {
      "$ref": "#/$defs/sourceIds"
    },
    "contentStatus": {
      "$ref": "#/$defs/contentStatus"
    },
    "translationReviewStatus": {
      "$ref": "#/$defs/translationReviewStatus"
    },
    "contentVersion": {
      "type": "integer",
      "minimum": 1
    },
    "reviewMetadata": {
      "type": [
        "object",
        "null"
      ]
    }
  },
  "additionalProperties": false
}
