{"recordType":"lesson","id":"hsk1-fixture-u01-l01","syllabusVersion":"GF0025-2021","level":1,"unitId":"hsk1-fixture-u01","order":1,"topic":"greeting","titleZh":"你好！","titleVi":"Xin chào!","objectives":["Nhận biết lời chào 你好","Dùng 我 và 你 trong phản xạ ngắn"],"prerequisiteIds":[],"vocabularyRefs":["hsk1-fixture-v-nihao","hsk1-fixture-v-wo","hsk1-fixture-v-ni","hsk1-fixture-v-shi","hsk1-fixture-v-ma"],"grammarRefs":["hsk1-fixture-g-a-shi-b","hsk1-fixture-g-ma-question"],"characterRefs":["hsk1-fixture-c-ni","hsk1-fixture-c-hao"],"sections":[{"id":"hsk1-fixture-l01-situation","type":"situation","titleVi":"Gặp bạn mới","content":"Hai người gặp nhau trước lớp và chào hỏi lần đầu."},{"id":"hsk1-fixture-l01-dialogue","type":"dialogue","titleVi":"Hội thoại","content":[{"speaker":"A","zh":"你好！","vi":"Xin chào!"},{"speaker":"B","zh":"你好！你是学生吗？","vi":"Xin chào! Bạn là học sinh phải không?"}]},{"id":"hsk1-fixture-l01-summary","type":"summary","titleVi":"Tổng kết","content":"Dùng 你好 để chào; thêm 吗 cuối câu trần thuật để tạo câu hỏi có-không."}],"practiceRefs":["hsk1-fixture-ex-vocab-01","hsk1-fixture-ex-grammar-01","hsk1-fixture-ex-listening-01","hsk1-fixture-ex-speaking-01"],"reviewRefs":[],"estimatedMinutes":20,"difficulty":1,"sourceIds":["moe-gf0025-2021-standard","cti-hsk3-current-syllabus-2026"],"contentStatus":"fixture","translationReviewStatus":"machine-assisted","contentVersion":1,"reviewMetadata":null}