{"recordType":"lesson","id":"hsk1-fixture-u01-l02","syllabusVersion":"GF0025-2021","level":1,"unitId":"hsk1-fixture-u01","order":2,"topic":"identity","titleZh":"我叫安","titleVi":"Tôi tên An","objectives":["Giới thiệu tên bằng 叫","Hỏi tên người đối diện","Ôn lời chào trong ngữ cảnh mới"],"prerequisiteIds":["hsk1-fixture-u01-l01"],"vocabularyRefs":["hsk1-fixture-v-jiao","hsk1-fixture-v-mingzi","hsk1-fixture-v-ren","hsk1-fixture-v-xuesheng","hsk1-fixture-v-laoshi"],"grammarRefs":["hsk1-fixture-g-jiao-name","hsk1-fixture-g-ma-question"],"characterRefs":["hsk1-fixture-c-ni","hsk1-fixture-c-hao"],"sections":[{"id":"hsk1-fixture-l02-situation","type":"situation","titleVi":"Làm quen trước giờ học","content":"An gặp một bạn học mới và tự giới thiệu."},{"id":"hsk1-fixture-l02-reading","type":"reading","titleVi":"Đọc ngắn","content":{"zh":"你好，我叫安。我是学生。","vi":"Xin chào, tôi tên An. Tôi là học sinh."}},{"id":"hsk1-fixture-l02-review","type":"review","titleVi":"Ôn cách quãng","content":"Lời chào được dùng lại trong một tình huống mới, không thay thế bằng câu hỏi giống hệt."}],"practiceRefs":["hsk1-fixture-ex-reading-01","hsk1-fixture-ex-writing-01","hsk1-fixture-ex-integrated-01"],"reviewRefs":["hsk1-fixture-ex-vocab-review-01"],"estimatedMinutes":25,"difficulty":1,"sourceIds":["moe-gf0025-2021-standard","cti-hsk3-current-syllabus-2026"],"contentStatus":"fixture","translationReviewStatus":"machine-assisted","contentVersion":1,"reviewMetadata":{"firstIntroducedIn":"hsk1-fixture-u01-l01","reviewStage":1,"reviewReason":"spaced-recall","previousExerciseId":"hsk1-fixture-ex-vocab-01"}}